{
  "uid": "req-eb0328e6",
  "slug": "secure-process-resetting-forgotten-password-implemented-does-not",
  "current": {
    "release": "5.0.0",
    "id": "V6.4.3",
    "chapter_id": "V6",
    "chapter_name": "Authentication",
    "section_id": "V6.4",
    "section_name": "Authentication Factor Lifecycle and Recovery",
    "level": 2,
    "text": "Verify that a secure process for resetting a forgotten password is implemented, that does not bypass any enabled multi-factor authentication mechanisms.",
    "source": "sources/asvs/asvs_5.0.0.csv",
    "status": "current"
  },
  "master": {
    "id": "V6.4.3",
    "level": 2,
    "text": "Verify that a secure process for resetting a forgotten password is implemented, that does not bypass any enabled multi-factor authentication mechanisms.",
    "differs_from_release": false,
    "checked_at": "2026-08-24"
  },
  "identifiers": [
    {
      "release": "5.0.0",
      "id": "V6.4.3",
      "level": 2,
      "status": "current"
    },
    {
      "release": "4.0.3",
      "id": "V2.5.6",
      "level": 1,
      "status": "predecessor"
    },
    {
      "release": "4.0.3",
      "id": "V1.1.2",
      "level": null,
      "status": "predecessor"
    },
    {
      "release": "pre-release",
      "id": "V1.3.2",
      "level": null,
      "status": "historical"
    },
    {
      "release": "pre-release",
      "id": "V10.3.5",
      "level": null,
      "status": "historical"
    },
    {
      "release": "pre-release",
      "id": "V10.7.1",
      "level": null,
      "status": "historical"
    },
    {
      "release": "4.0.3",
      "id": "V11.1.4",
      "level": null,
      "status": "predecessor"
    },
    {
      "release": "4.0.3",
      "id": "V12.3.2",
      "level": null,
      "status": "predecessor"
    },
    {
      "release": "4.0.3",
      "id": "V14.3.2",
      "level": null,
      "status": "predecessor"
    },
    {
      "release": "pre-release",
      "id": "V16.3.1",
      "level": null,
      "status": "historical"
    },
    {
      "release": "4.0.3",
      "id": "V3.4.1",
      "level": null,
      "status": "predecessor"
    },
    {
      "release": "4.0.3",
      "id": "V3.5.2",
      "level": null,
      "status": "predecessor"
    },
    {
      "release": "pre-release",
      "id": "V3.7.3",
      "level": null,
      "status": "historical"
    },
    {
      "release": "4.0.3",
      "id": "V4.1.4",
      "level": null,
      "status": "predecessor"
    },
    {
      "release": "4.0.3",
      "id": "V5.2.5",
      "level": null,
      "status": "predecessor"
    },
    {
      "release": "4.0.3",
      "id": "V6.2.4",
      "level": null,
      "status": "predecessor"
    },
    {
      "release": "pre-release",
      "id": "V6.3.5",
      "level": null,
      "status": "historical"
    },
    {
      "release": "pre-release",
      "id": "V6.3.7",
      "level": null,
      "status": "historical"
    },
    {
      "release": "4.0.3",
      "id": "V8.1.4",
      "level": null,
      "status": "predecessor"
    },
    {
      "release": "4.0.3",
      "id": "V9.2.3",
      "level": null,
      "status": "predecessor"
    }
  ],
  "lineage": {
    "origin_kind": "carried_forward",
    "predecessors": [
      {
        "release": "4.0.3",
        "id": "V2.5.6",
        "relation": "modified",
        "text": "Verify forgotten password, and other recovery paths use a secure recovery mechanism, such as time-based OTP (TOTP) or other soft token, mobile push, or another offline recovery mechanism. ([C6](https://owasp.org/www-project-proactive-controls/#div-numbering))",
        "note": null
      }
    ],
    "mapping_entry": {
      "raw": "MODIFIED, MOVED FROM v4.0.3-2.5.6",
      "status": "MODIFIED",
      "agrees_with_git": false,
      "note": "Mapping predecessor text is dissimilar to the current requirement; git/content lineage diverges from the ID slot."
    },
    "events": [
      {
        "date": "2018-11-14",
        "kind": "renumbered",
        "commit": "0f5ac563",
        "actor": "vanderaj",
        "id_at_time": "V3.5.2",
        "summary": "Update 0x12-V3-Session-management.md",
        "citations": [
          {
            "type": "commit",
            "url": "https://github.com/OWASP/ASVS/commit/0f5ac563",
            "commit": "0f5ac563"
          }
        ]
      },
      {
        "date": "2018-11-15",
        "kind": "reworded",
        "commit": "4d821098",
        "actor": "mb",
        "id_at_time": "V5.2.5",
        "summary": "Update 0x11-V2-Authentication.md",
        "citations": [
          {
            "type": "commit",
            "url": "https://github.com/OWASP/ASVS/commit/4d821098",
            "commit": "4d821098"
          }
        ]
      },
      {
        "date": "2018-11-18",
        "kind": "reworded",
        "commit": "57c5b7c7",
        "actor": "vanderaj",
        "id_at_time": "V3.5.2",
        "summary": "First pass at Grammerly",
        "citations": [
          {
            "type": "commit",
            "url": "https://github.com/OWASP/ASVS/commit/57c5b7c7",
            "commit": "57c5b7c7"
          }
        ]
      },
      {
        "date": "2018-12-28",
        "kind": "renumbered",
        "commit": "8fbec5e2",
        "actor": "glenn.ten.cate",
        "id_at_time": "V5.2.5",
        "summary": "Update 0x11-V2-Authentication.md",
        "citations": [
          {
            "type": "commit",
            "url": "https://github.com/OWASP/ASVS/commit/8fbec5e2",
            "commit": "8fbec5e2"
          }
        ]
      },
      {
        "date": "2019-01-13",
        "kind": "renumbered",
        "commit": "bb1153f1",
        "actor": "tghosth",
        "id_at_time": "V8.1.4",
        "summary": "Fix 8.1 numbering",
        "citations": [
          {
            "type": "commit",
            "url": "https://github.com/OWASP/ASVS/commit/bb1153f1",
            "commit": "bb1153f1"
          }
        ]
      },
      {
        "date": "2019-01-28",
        "kind": "reworded",
        "commit": "1ffc2bd1",
        "actor": "tghosth",
        "id_at_time": "V3.5.2",
        "summary": "MInor tweaks to V3",
        "citations": [
          {
            "type": "commit",
            "url": "https://github.com/OWASP/ASVS/commit/1ffc2bd1",
            "commit": "1ffc2bd1"
          }
        ]
      },
      {
        "date": "2019-01-28",
        "kind": "renumbered",
        "commit": "9b41c892",
        "actor": "tghosth",
        "id_at_time": "V3.5.2",
        "summary": "Fix number formatting V3",
        "citations": [
          {
            "type": "commit",
            "url": "https://github.com/OWASP/ASVS/commit/9b41c892",
            "commit": "9b41c892"
          }
        ]
      },
      {
        "date": "2019-02-10",
        "kind": "reworded",
        "commit": "9a174282",
        "actor": "tghosth",
        "id_at_time": "V1.1.2",
        "summary": "Making minor tweaks to V1",
        "citations": [
          {
            "type": "commit",
            "url": "https://github.com/OWASP/ASVS/commit/9a174282",
            "commit": "9a174282"
          }
        ]
      },
      {
        "date": "2019-02-12",
        "kind": "reworded",
        "commit": "a865c521",
        "actor": "mb",
        "id_at_time": "V1.1.2",
        "summary": "Rewording of 1.x.x",
        "citations": [
          {
            "type": "commit",
            "url": "https://github.com/OWASP/ASVS/commit/a865c521",
            "commit": "a865c521"
          }
        ]
      },
      {
        "date": "2019-02-14",
        "kind": "renumbered",
        "commit": "48e69a5f",
        "actor": "mb",
        "id_at_time": "V3.5.2",
        "summary": "Grammar updates",
        "citations": [
          {
            "type": "commit",
            "url": "https://github.com/OWASP/ASVS/commit/48e69a5f",
            "commit": "48e69a5f"
          }
        ]
      },
      {
        "date": "2019-02-15",
        "kind": "renumbered",
        "commit": "62984569",
        "actor": "vanderaj",
        "id_at_time": "V5.2.5",
        "summary": "Resolve #385",
        "citations": [
          {
            "type": "commit",
            "url": "https://github.com/OWASP/ASVS/commit/62984569",
            "commit": "62984569"
          },
          {
            "type": "issue_body",
            "url": "https://github.com/OWASP/ASVS/issues/385",
            "issue": 385
          }
        ]
      },
      {
        "date": "2019-02-15",
        "kind": "renumbered",
        "commit": "a80bb4cb",
        "actor": "vanderaj",
        "id_at_time": "V4.1.4",
        "summary": "Resolve #442",
        "citations": [
          {
            "type": "commit",
            "url": "https://github.com/OWASP/ASVS/commit/a80bb4cb",
            "commit": "a80bb4cb"
          },
          {
            "type": "issue_body",
            "url": "https://github.com/OWASP/ASVS/issues/442",
            "issue": 442
          }
        ]
      },
      {
        "date": "2019-02-18",
        "kind": "renumbered",
        "commit": "35f172fe",
        "actor": "vanderaj",
        "id_at_time": "V9.2.3",
        "summary": "Renumber and revise Communications",
        "citations": [
          {
            "type": "commit",
            "url": "https://github.com/OWASP/ASVS/commit/35f172fe",
            "commit": "35f172fe"
          }
        ]
      },
      {
        "date": "2019-02-18",
        "kind": "reworded",
        "commit": "7a35c26a",
        "actor": "vanderaj",
        "id_at_time": "V4.1.4",
        "summary": "Remove CWSS column",
        "citations": [
          {
            "type": "commit",
            "url": "https://github.com/OWASP/ASVS/commit/7a35c26a",
            "commit": "7a35c26a"
          }
        ]
      },
      {
        "date": "2019-02-18",
        "kind": "reworded",
        "commit": "83b75815",
        "actor": "vanderaj",
        "id_at_time": "V5.2.5",